Speaker,Utterance,Dialogue_Act,Dialogue_ID
T_1_S7,"Idealmente, bisognerebbe mangiare almeno cinque porzioni di frutta e verdura , ogni giorno.",PERSUASION-SUGGEST,25
T_1_U7,e oltre la frutta?,INFO-REQUEST,25
T_1_S8,"Limitare la dose di grassi, in particolare quelli saturi, rappresenta un elemento fondamentale di una dieta sana.",PERSUASION-SUGGEST,25
T_1_U8,quali alimenti contengono i grassi insaturi?,INFO-REQUEST,25
T_1_S9,"Mi dispiace, non so rispondere a questa domanda.",ANSWER,25
T_1_U9,secondo te è importante considerare il peso di una persona nel momento in cui decide di iniziare una dieta?,INFO-REQUEST,25
T_1_S10,Si,ANSWER,25
T_1_U10,e quali altri accorgimenti dovrebbe prendere una persona in sovrappeso che decide di iniziare una dieta?,INFO-REQUEST,25
T_1_S11,"Bisognerebbe mangiare solo se si ha fame, ed aspettare che la digestione sia completata, prima di assumere altri cibi.",PERSUASION-SUGGEST,25
T_1_U11,una persona con problemi di cuore potrebbe cominciare una dieta?,INFO-REQUEST,25
T_1_S12,Credo di si,ANSWER,25
T_1_U12,quali problemi di carattere medico può provocare una cattiva alimentazione?,INFO-REQUEST,25
T_1_S13,"Molti pensano che mangiare sia soltanto un piacere o un modo per sopravvivere. Invece contribuisce in modo fondamentale al benessere. A lungo andare, nutrirsi in modo sbagliato rischia di influire negativamente sulla tua salute. Lo sai, vero?",PERSUASION-SUGGEST,25
T_1_U13,"si, ma in che modo?",SOLICITATION-REQ_CLARIFICATION,25
T_1_S14,"Mi dispiace, non so rispondere a questa domanda.",ANSWER,25
T_1_U14,se si mangiano molte patatine fritte è un bene?,INFO-REQUEST,25
T_1_S15,No,ANSWER,25
T_1_U15,perchè?,SOLICITATION-REQ_CLARIFICATION,25
T_1_S16,"Il fritto piace a molti, ma andrebbe limitato per quanto possibile. Le cose che compri alle macchinette contengono molte sostanze dannose e pochi elementi nutritivi.",PERSUASION-SUGGEST,25
T_1_U16,"ho capito, ma qual'è il rischio salutare di assumere cibi fritti?",INFO-REQUEST,25
T_1_S17,"Pensi che la tua dieta sia giusta, o vorresti cambiare le tue abitudini alimentari?",QUESTION,25
T_1_U17,penso che dovrei controllare maggiormente il consumo di dolciumi.,STATEMENT,25
T_1_S18,Hai mai desiderato di cambiare dieta?,QUESTION,25
T_1_U18,si,GENERIC-ANSWER,25
T_1_S19,"Il tuo peso ti sembra giusto, o vorresti cambiarlo?",QUESTION,25
T_1_U19,ho quattro chili di troppo e quindi vorrei cambiarlo.,STATEMENT,25
T_1_S20,Per quale motivo non hai mai provato?,QUESTION,25
T_1_U20,perchè non sono molto paziente.,STATEMENT,25
T_1_S21,Prova a pensare a tutto quello che mangi durante il giorno. Ti sembra di assumere tutte le sostanze di cui avresti bisogno?,QUESTION,25
T_1_U21,assumo regolarmente carboidrati proteine e vitamine. forse scarseggio con i sali minerali e abbondo con i grassi.,STATEMENT,25
T_1_S22,"Non bisogna eliminare completamente i grassi.Basta limitarne le dosi, soprattutto di quelli saturi, privilegiando invece i grassi insaturi, come il magnifico olio di oliva!",PERSUASION-SUGGEST,25
T_1_U22,io ho difficoltà ad organizzare la mia dieta per mancanza di tempo.,STATEMENT,25
T_1_S23,"Certo, organizzarti in modo da mangiare correttamente probabilmente non ti sembra facile, specialmente se lavori o studi e non hai nessuno che ti aiuta. Devi trovare il tempo per fare la spesa e cucinare un pasto variato, mentre preparare un panino oppure mangiare quello che capita richiede sicuramente meno tempo.",OFFER-GIVE-INFO,25
T_1_U23,sono invalido al 90%,STATEMENT,25
T_1_S24,Ti consiglio di consultare un esperto,ANSWER,25
T_1_U24,mi indicheresti quale?,INFO-REQUEST,25
T_1_S25,Grazie e arrivederci!,CLOSING,25
T_1_U25,ciao e grazie per la tua pazienza e collaborazione e tu non mi saluti?,KIND-ATTITUDE_SMALL-TALK,25
T_1_S26,Grazie e arrivederci!,CLOSING,25
T_1_U26,dici sempre le stesse cose?,REJECT,25
T_1_S27,Credo di no,ANSWER,25
T_1_U27,"e io invece si, comunque non importa.",KIND-ATTITUDE_SMALL-TALK,25
T_1_S28,Complimenti e arrivederci!,CLOSING,25
T_12_S1,"Ciao, il mio nome e' Valentina. Sono qui per darti dei suggerimenti su come migliorare la tua dieta. Quali sono le tue abitudini alimentari?",OPENING,26
T_12_U1,dieta mediterranea,STATEMENT,26
T_12_S2,Ti piace mangiare?,QUESTION,26
T_12_U2,si,GENERIC-ANSWER,26
T_12_S3,Segui una dieta variata?,QUESTION,26
T_12_U3,si,GENERIC-ANSWER,26
T_12_S4,Che pensi di un bel piatto di spaghetti?,QUESTION,26
T_12_U4,buoni,STATEMENT,26
T_12_S5,Che pensi di un bel piatto di frittura?,QUESTION,26
T_12_U5,non mi piace molto,STATEMENT,26
T_12_S6,Ti attirano molto i dolci?,QUESTION,26
T_12_U6,si purtroppo,STATEMENT,26
T_12_S7,Ne mangi spesso?,QUESTION,26
T_12_U7,a volte,GENERIC-ANSWER,26
T_12_S8,"Pensi che la tua dieta sia giusta, o vorresti cambiare le tue abitudini alimentari?",QUESTION,26
T_12_U8,un poco,STATEMENT,26
T_12_S9,"Il tuo peso ti sembra giusto, o vorresti cambiarlo?",QUESTION,26
T_12_U9,dimagrire,STATEMENT,26
T_12_S10,Prova a pensare a tutto quello che mangi durante il giorno: ti sembra di assumere tutte le sostanze di cui avresti bisogno?,QUESTION,26
T_12_U10,forse,GENERIC-ANSWER,26
T_12_S11,E allora? Dimmi qualcosa di piu'!,ENCOURAGE-SORRY,26
T_12_U11,tipo,SOLICITATION-REQ_CLARIFICATION,26
T_12_S12,Hai mai provato a chiederti a cosa sono dovute le tue abitudini alimentari?,QUESTION,26
T_12_U12,no,GENERIC-ANSWER,26
T_12_S13,"Il nostro organismo ha bisogno di oltre 40 sostanze nutritive diverse. Quindi, per mantenersi in forma, bisogna diversificare i i cibi contenuti nella dieta.",PERSUASION-SUGGEST,26
T_12_U13,va bene,AGREE,26
T_12_S14,"Dimmi, ci sono aspetti particolari della dieta sui quali ti piacerebbe avere maggiori informazioni? Posso provare a risponderti, anche se le mie conoscenze sono ancora incomplete.",OFFER-GIVE-INFO,26
T_12_U14,va bene,AGREE,26
T_12_S15,"Hai mai riflettuto su quanto sia importante, per te, mangiare bene e sentirti in forma? Hai mai riflettuto se sia o no importante, per te, mangiare in modo sano ed equilibrato e sentirti bene e in forma?",QUESTION,26
T_12_U15,si,GENERIC-ANSWER,26
T_12_S16,"Molti pensano che mangiare sia soltanto un piacere o un modo per sopravvivere. Invece contribuisce in modo fondamentale al benessere. A lungo andare, nutrirsi in modo sbagliato rischia di influire negativamente sulla salute. Lo sai, vero?",PERSUASION-SUGGEST,26
T_12_U16,certo infatti cerco di mangiare sano,AGREE,26
T_12_S17,"Ah, bello! Alimentazione corretta e abitudini sane influiscono sul nostro aspetto, su come ci sentiamo, su quanto riusciamo a goderci la vita. Scelte alimentari intelligenti adottate nel periodo infantile e mantenute da adulti possono contribuire a ridurre il rischio di patologie quali obesita', malattie cardiache, ipertensione, diabete, alcuni tipi di cancro e osteoporosi.",PERSUASION-SUGGEST,26
T_12_U17,dimmi qualcosa di piu,INFO-REQUEST,26
T_12_S18,"Una cattiva alimentazione puo' causare seri danni, come diversi tipi di tumori. Il consumo eccessivo di grassi provoca un aumento del peso corporeo per accumulo di tessuto adiposo, aumentando i rischi di problemi  cardiocircolatori e respiratori. Un aumento del colesterolo favorisce infarto e ictus.",PERSUASION-SUGGEST,26
T_12_U18,cosa devo mangiare per evitare queste patologie,INFO-REQUEST,26
T_12_S19,"In una dieta equilibrata, almeno il 50 percento delle calorie totali dovrebbe provenire da cibi a base di carboidrati. I carboidrati, di qualsiasi tipo, fanno bene alla salute. Aiutano a tenere sotto controllo il peso, soprattutto se abbinati ad una attivita' fisica costante, sono fondamentali per una corretta funzione intestinale e sono un combustibile importante per il cervello e i muscoli. Una dieta contenente un livello ottimale di carboidrati puo' aiutare a prevenire un accumulo di grassi, fornendo il carburante immediatamente disponibile per l'attivita' fisica, mentre la fibra alimentare aiuta l'intestino a funzionare correttamente.",PERSUASION-SUGGEST,26
T_12_U19,quali sono e quale è la giustsa quantità,INFO-REQUEST,26
T_12_S20,"Idealmente un pasto dovrebbe contenere da 75 a 100 grammi di carne, un frutto di media grandezza, un piccolo piatto di pasta o 50 grammi di gelato. I cibi pronti permettono di controllare le porzioni riportando sulla confezione il valore energetico in calorie.",OFFER-GIVE-INFO,26
T_12_U20,la mia dieta ti sembra giusta,INFO-REQUEST,26
T_12_S21,Credo di si,ANSWER,26
T_12_U21,sono stata promossa,KIND-ATTITUDE_SMALL-TALK,26
T_12_S22,Puo' darsi,ANSWER,26
T_12_U22,tu cosa mangi,KIND-ATTITUDE_SMALL-TALK,26
T_12_S23,Forse dimentichi che io sono un agente artificiale,TALK-ABOUT-SELF,26
T_12_U23,pensavo avessi preparato una dieta tipo pure per te come esempio,KIND-ATTITUDE_SMALL-TALK,26
T_12_S24,"Non sono in grado di mangiare, e quindi non seguo diete particolari .",TALK-ABOUT-SELF,26
T_12_U24,ti saluto grazie per la chiacchierata,CLOSING,26
T_12_S25,"Se hai dei problemi, in futuro, torna da me; proveremo a risolverli insieme",OFFER-GIVE-INFO,26
T_12_U25,mi devi parlare della attività fisica se ne hai le conoscenze,INFO-REQUEST,26
T_12_S26,Purtroppo sono poco esperta in questo campo.,ANSWER,26
T_12_U26,che ne pensi del consumo eccessivo di dolci,INFO-REQUEST,26
T_12_S27,"I dolci sono da evitare, ovvero da limitare a particolari occasioni. Sono da preferire i gelati alla frutta e i dolci secchi o con marmellata, evitando quelli farciti con panna o creme elaborate, e, quindi, ricchi in grassi e calorie.",PERSUASION-SUGGEST,26
T_12_U27,perchè,SOLICITATION-REQ_CLARIFICATION,26
T_12_S28,"Un eccesso di grasso corporeo costituisce un fattore di rischio elevato per lo sviluppo di molti disturbi quali malattie cardiache, pressione arteriosa alta (ipertensione), diabete di tipo 2 e alcuni tipi di cancro. Limitare la quantita' di grassi, in particolare quelli saturi, e' un elemento fondamentale di una dieta sana. I grassi saturi sono contenuti in quasi tutti gli alimenti di origine animale : ad esempio, il burro, il formaggio, la carne, il latte e lo yogurt intero.  Ma anche diversi prodotti di origine vegetale, come la margarina e gli olii di cocco e di palma, contengono grassi saturi. I grassi insaturi si trovano invece in alcuni pesci (il cosiddetto pesce azzurro) e in alcuni olii vegetali, come quello di oliva.",PERSUASION-SUGGEST,26
T_12_U28,però è il cibo che mi piace di più,REJECT,26
T_12_S29,Guai ad eliminare il piacere di mangiare!  Le regole non vanno applicate in modo troppo rigido!,ENCOURAGE-SORRY,26
T_4_S1,"Ciao, il mio nome e' Valentina. Sono qui per darti dei suggerimenti su come migliorare la tua dieta.",OPENING,27
T_4_U1,ciao sono Carlo e sono molto contento di sottopormi a questo esperimento,OPENING,27
T_4_S2,Quali sono le tue abitudini alimentari?,QUESTION,27
T_4_U2,"abbastanza scordinate, soprattutto in estete, perche tendo a mangiare spesso durante la giornata e disordinatamente.",STATEMENT,27
T_4_S3,Ti piace mangiare?,QUESTION,27
T_4_U3,"molto. però cerco di fare attenzione a quello che mangio, perche ci tengo alla mia forma fisica. non mi piacerebbe diventare ciccione",STATEMENT,27
T_4_S4,Che cosa hai mangiato per pranzo?,QUESTION,27
T_4_U4,"solo un piatto di pasta, perchè ho male hai denti",STATEMENT,27
T_4_S5,Ti piacciono frutta e  verdura?,QUESTION,27
T_4_U5,"di frutta non faccio un grande uso, ma la verdura molto. forse ti sembrerà strano?",STATEMENT,27
T_4_S6,Credo di no,ANSWER,27
T_4_U6,siccome è insolito che a qualcuno piaccia molto la verdura per questo te lo chiedevo. comunque a te piace la frutta e la verdura?,KIND-ATTITUDE_SMALL-TALK,27
T_4_S7,"Mi dispiace, non so rispondere a questa domanda.",ANSWER,27
T_4_U7,"hai ragione, scusami forse tu non hai l'abitudine di mangiare. vero?",KIND-ATTITUDE_SMALL-TALK,27
T_4_S8,Si,ANSWER,27
T_4_U8,mi aspettavo da te delle risposte più chiare e complete.,REJECT,27
T_4_S9,Ti attirano molto i dolci?,QUESTION,27
T_4_U9,"non molto, preferisco di più il salato.",STATEMENT,27
T_4_S10,Che pensi di un bel piatto di frittura?,QUESTION,27
T_4_U10,a te piacciono i dolci? la frittura comunque non mi ispira molto. fa ingrassare non è vero?,INFO-REQUEST,27
T_4_S11,"Il fritto piace a molti, ma andrebbe limitato per quanto possibile. Le cose che compri alle macchinette contengono molte sostanze dannose e pochi elementi nutritivi.",PERSUASION-SUGGEST,27
T_4_U11,penso che tu abbia ragione. ma ti sei mai chiesta perchè le cose ch fanno più male sono sempre le più buone?,SOLICITATION-REQ_CLARIFICATION,27
T_4_S12,No,ANSWER,27
T_4_U12,ecco perche allora ingrassiamo senza rendercene conto? IO invece cerco di fare molta attenzione a quello che mangio.,STATEMENT,27
T_4_S13,Prova a pensare a tutto quello che mangi durante il giorno. Ti sembra di assumere tutte le sostanze di cui avresti bisogno?,QUESTION,27
T_4_U13,"penso di assumere tutte le sostanze di cui avrei bisogno, anche se qualce volta esagere nelm mangiare. Credo che ci vorrebbe un buon autocontrollo per una buona alimentazione.",STATEMENT,27
T_4_S14,Credo di si,ANSWER,27
T_4_U14,cosa servirebbe secondo te per un buon autocontrollo,INFO-REQUEST,27
T_4_S15,"Bisognerebbe mangiare solo se si ha fame, ed aspettare che la digestione sia completata, prima di assumere altri cibi.",PERSUASION-SUGGEST,27
T_4_U15,"a volte però fattori come lo stress, l'ansia e la tristezza ci portano a mangiare senza misura?",INFO-REQUEST,27
T_4_S16,Si,ANSWER,27
T_4_U16,allora forse bisognerebbe non avere molte scorte nel frigorifero.,SOLICITATION-REQ_CLARIFICATION,27
T_4_S17,"Hai mai riflettuto su quanto sia importante, per te, mangiare bene e sentirti in forma?",QUESTION,27
T_4_U17,si. soprattutto quando affronto periodi di stress e tendo a mangiare molto .,STATEMENT,27
T_4_S18,"Pensi che la tua dieta sia giusta, o vorresti cambiare le tue abitudini alimentari?",QUESTION,27
T_4_U18,"mi piacerebbe si aquisire delle sane abitudini alimentari, ma è proprio difficile. anche perchè non sempre si è a casa all'ora di pranza. ed proprio quello che ci porta a mangiare in maniera poco sana. tu cosa mi consigli?",SOLICITATION-REQ_CLARIFICATION,27
T_4_S19,Diverse ricerche a livello internazionale hanno dimostrato quanto sia importante una dieta ricca di vegetali e di frutta.,PERSUASION-SUGGEST,27
T_4_U19,cosa fac cio aloora quando sono fuori a pranzo mi porto il fagottino con della frutta?,INFO-REQUEST,27
T_4_S20,Si,ANSWER,27
T_4_U20,in base alle risposte che ti ho dato pensi che io segua delle buone abitudini alimentari?,INFO-REQUEST,27
T_4_S21,Credo di no,ANSWER,27
T_4_U21,perchè no?,SOLICITATION-REQ_CLARIFICATION,27
T_4_S22,"Il nostro organismo ha bisogno di oltre 40 sostanze nutritive diverse. Quindi, per mantenersi in forma, bisogna diversificare i cibi contenuti nella dieta.",PERSUASION-SUGGEST,27
T_4_U22,quindi potrei saltare il pranzo e fare un'unico pasto la sera?,INFO-REQUEST,27
T_4_S23,No. Mangiare ad orari fissi aiuta ad evitare di saltare i pasti e di trascurare sostanze che spesso non vengono compensate nei pasti successivi.,PERSUASION-SUGGEST,27
T_4_U23,però il lavoro in questo alcune volte non ci aiuta. tu che lavoro fai? sei per caso una dietologa?,REJECT,27
T_4_S24,"Mi dispiace, non so rispondere a questa domanda.",ANSWER,27
T_4_U24,"scusami. ma siccome ti vedo molto informata per quanto riguarda l'alimentazione, mi chiedevo se eri in grado di prescrivermi una buona dieta.",KIND-ATTITUDE_SMALL-TALK,27
T_4_S25,Ti consiglio di consultare un esperto,ANSWER,27
T_4_U25,grazie per il suggerimento. ma tu ne conosci qualcuno?,KIND-ATTITUDE_SMALL-TALK,27
T_4_S26,"Mi dispiace, non so rispondere a questa domanda.",ANSWER,27
T_4_U26,va bene grazie per la conversazione e alla prosssima chiacchierata. spero tu abbia gradito chiacchierare con me.,KIND-ATTITUDE_SMALL-TALK,27
T_4_S27,Si,ANSWER,27
T_4_U27,grazie molto gentile. Ciao ciao,CLOSING,27
T_4_S28,Grazie e arrivederci!,CLOSING,27
S_15_S1,"Ciao, il mio nome e' Valentina. Sono qui per darti dei suggerimenti su come migliorare la tua dieta.",OPENING,28
S_15_U1,Dimmi che cosa mi vorresti consigliare?,SOLICITATION-REQ_CLARIFICATION,28
S_15_S2,Cosa mangi di solito?,QUESTION,28
S_15_U2,allora a me piace mangiare la carne. E tu invece cosa mangi di solito?,KIND-ATTITUDE_SMALL-TALK,28
S_15_S3,Che cosa hai mangiato per colazione?,QUESTION,28
S_15_U3,"Latte, biscotti e cereali",STATEMENT,28
S_15_S4,Che cosa hai mangiato per cena?,QUESTION,28
S_15_U4,"Ieri sera, patatine...",STATEMENT,28
S_15_S5,Ti alimenti spesso in questa maniera?,QUESTION,28
S_15_U5,"No, in maniera saltuaria",GENERIC-ANSWER,28
S_15_S6,"Il fritto piace a molti, ma andrebbe limitato per quanto possibile. L'alimentazione moderna, particolarmente...",PERSUASION-SUGGEST,28
S_15_U6,"Sì, lo so. A te piace il fritto?",KIND-ATTITUDE_SMALL-TALK,28
S_15_S7,Forse dimentichi che sono un agente artificiale. Gli agenti artificiali vivono in un mondo virtuale...,TALK-ABOUT-SELF,28
S_15_U7,Cosa pensi dei carboidrati?,INFO-REQUEST,28
S_15_S8,"In una dieta equilibrata, almeno il 50 percento delle calorie totali dovrebbe provenire da cibi a base di carboidrati",PERSUASION-SUGGEST,28
S_15_U8,E se si mangiano in quantità eccessiva?,INFO-REQUEST,28
S_15_S9,I carboidrati aiutano a tenere sotto controllo...,PERSUASION-SUGGEST,28
S_15_U9,In quali alimenti posso trovare i carboidrati?,INFO-REQUEST,28
S_15_S10,"Mi dispiace, non so rispondere a questa domanda",ANSWER,28
S_15_U10,"E per quanto riguarda i grassi, invece?",INFO-REQUEST,28
S_15_S11,"Il grasso e' la principale riserva di energia del corpo e la fonte calorica piu' concentrata della dieta. I depositi... Oltre a essere una scorta di energia, i depositi di grasso avvolgono e proteggono gli organi vitali e...",OFFER-GIVE-INFO,28
S_15_U11,E quando abbiamo l’obesità?,INFO-REQUEST,28
S_15_S12,Purtroppo sono poco esperta in questo campo.,ANSWER,28
S_15_U12,E dove posso trovare molti grassi?,INFO-REQUEST,28
S_15_S13,"I grassi insaturi si trovano in alcuni pesci, il cosiddetto pesce azzurro, e in alcuni oli vegetali... Una carenza di grassi insaturi provoca alterazioni della struttura e nella funzione di enzimi, determinando un certo numero di disturbi...",PERSUASION-SUGGEST,28
S_15_U13,E cosa mi dici delle vitamine?,INFO-REQUEST,28
S_15_S14,"La ricerca ha dimostrato che ingerire le dosi raccomandate di Vitamina A e C, fibre e sali minerali  può avere... Le vitamine A e C depurano il sangue e sono importanti per la crescita e la rigenerazione dei tessuti.",PERSUASION-SUGGEST,28
S_15_U14,Quanti pasti bisogna fare al giorno?,INFO-REQUEST,28
S_15_S15,"Bisognerebbe mangiare solo se si ha fame, ed aspettare che la digestione sia completata prima...",PERSUASION-SUGGEST,28
S_15_U15,Quale potrebbe essere un pranzo ideale?,INFO-REQUEST,28
S_15_S16,"Il nostro organismo ha bisogno di oltre 40 sostanze nutritive diverse. Quindi, per mantenersi in forma... Idealmente un pasto dovrebbe contenere da 75 a 100 grammi di carne, un frutto di media grandezza... I cibi pronti permettono di controllare le porzioni riportando sulla confezione il valore energetico in calorie.",PERSUASION-SUGGEST,28
S_15_U16,E’ importante mangiare la frutta?,INFO-REQUEST,28
S_15_S17,"Diverse ricerche a livello internazionale hanno dimostrato l’importanza di una dieta ricca di vegetali e di frutta. Idealmente, bisognerebbe mangiare almeno cinque porzioni di frutta e verdura al giorno. La porzione consigliata  risulta essere di circa 80 grammi: per esempio una mela, due o tre cucchiai di verdure...",PERSUASION-SUGGEST,28
S_15_U17,Che intendi per verdura cruda?,INFO-REQUEST,28
S_15_S18,"Sono spiacente, ma non ho capito quello che hai detto. Potresti ripetere grazie!",ANSWER,28
S_15_U18,Che intendi per verdura cruda?,INFO-REQUEST,28
S_15_S19,"Mi dispiace, non so rispondere a questa domanda",ANSWER,28
S_15_U19,E del latte cosa mi dici?,INFO-REQUEST,28
S_15_S20,"Un eccesso di grasso corporeo costituisce un fattore di rischio elevato per lo sviluppo di malattie... Limitare la quantita' di grassi, in particolare quelli saturi, e' un elemento fondamentale di una dieta sana.",PERSUASION-SUGGEST,28
S_15_U20,E’ importante bere il latte?,INFO-REQUEST,28
S_15_S21,"Credo di sì. Hai mai riflettuto sull’importanza che ha, per te, mangiar bene e sentirti in forma?",QUESTION,28
S_15_U21,Penso sia molto importante per… sia per l’organismo che per…,STATEMENT,28
S_15_S22,E allora? Dimmi qualcosa di più!,ENCOURAGE-SORRY,28
S_15_U22,"Ehm, la mia alimentazione non è molto corretta…",STATEMENT,28
S_15_S23,"Va abbastanza bene, ma puoi migliorare!",ENCOURAGE-SORRY,28
S_25_S1,"Ciao, il mio nome e' Valentina. Sono qui per darti dei suggerimenti su come migliorare la tua dieta.",OPENING,29
S_25_U1,"va bene, ciao.",OPENING,29
S_25_S2,Cosa mangi di solito?,QUESTION,29
S_25_U2,pasta.,STATEMENT,29
S_25_S3,Che pensi di un bel piatto di spaghetti?,QUESTION,29
S_25_U3,Ottimo,STATEMENT,29
S_25_S4,Fantastico! I carboidrati aiutano a tenere sotto controllo...,PERSUASION-SUGGEST,29
S_25_U4,Interessante…,GENERIC-ANSWER,29
S_25_S5,Che cosa hai mangiato per colazione?,QUESTION,29
S_25_U5,Caffè e latte e due brioches.,STATEMENT,29
S_25_S6,Che cosa hai mangiato per cena?,QUESTION,29
S_25_U6,Petto di pollo e formaggio.,STATEMENT,29
S_25_S7,Ti alimenti spesso in questa maniera?,QUESTION,29
S_25_U7,"No, spesso.",GENERIC-ANSWER,29
S_25_S8,Ti piacciono frutta e  verdura?,QUESTION,29
S_25_U8,"Frutta si, Verdura un po’ meno.",STATEMENT,29
S_25_S9,Diverse ricerche a livello internazionale hanno dimostrato l’importanza di una dieta ricca di vegetali e di frutta Che pensi di un piatto di frittura?,QUESTION,29
S_25_U9,"Buona, soprattutto se sia pesce.",STATEMENT,29
S_25_S10,Ne mangi spesso?,QUESTION,29
S_25_U10,Ogni tanto,GENERIC-ANSWER,29
S_25_S11,"Ah, bene!",ENCOURAGE-SORRY,29
S_25_U11,Poi mangio spesso pizza.,STATEMENT,29
S_25_S12,"Difficile resistere alle tentazioni! In una dieta equilibrata, almeno il 50 percento delle calorie totali dovrebbe provenire da cibi a base di carboidrati",PERSUASION-SUGGEST,29
S_25_U12,Poi bevo spesso bevande gassate.,STATEMENT,29
S_25_S13,E allora? Dimmi qualcosa di più!,ENCOURAGE-SORRY,29
S_25_U13,Cosa non dovrei bere?,INFO-REQUEST,29
S_25_S14,"Mi dispiace, non so rispondere a questa domanda",ANSWER,29
S_25_U14,Cosa dovrei mangiare prima di una partita a calcetto?,INFO-REQUEST,29
S_25_S15,"Non esistono alimenti buoni o cattivi, ma soltanto diete buone o cattive. Qualsiasi cibo può rientrare in uno... Posso darti dei suggerimenti su quale potrebbe essere  una dieta corretta per te, se vuoi.",PERSUASION-SUGGEST,29
S_25_U15,Dammi dei consigli. Dammi dei consigli.,SOLICITATION-REQ_CLARIFICATION,29
S_25_S16,"Il nostro organismo ha bisogno di oltre 40 sostanze nutritive diverse. Quindi, per mantenersi in forma... Segui una dieta variata?",QUESTION,29
S_25_U16,Tendo a mangiare quasi sempre le stesse cose.,STATEMENT,29
S_25_S17,Ho l’impressione che le tue abitudini alimentari non siano ideali.,ENCOURAGE-SORRY,29
S_25_U17,Perché?,SOLICITATION-REQ_CLARIFICATION,29
S_25_S18,"Alimentazione corretta e abitudini sane influiscono sul nostro aspetto, sulla nostra salute, su quanto riusciamo a goderci la vita...",PERSUASION-SUGGEST,29
S_25_U18,In che modo?,INFO-REQUEST,29
S_25_S19,Ti attirano molto i dolci?,QUESTION,29
S_25_U19,Sì,GENERIC-ANSWER,29
S_25_S20,"I dolci sono da evitare, ovvero da limitare a particolari occasioni... Prova a pensare a tutto quello che mangi durante il giorno: ti sembra di assumere tutte le sostanze...?",QUESTION,29
S_25_U20,Credo di sì,GENERIC-ANSWER,29
S_25_S21,E allora? Dimmi qualcosa di più!,ENCOURAGE-SORRY,29
S_25_U21,"Forse dovrei mangiare più pesce, perché mangio spesso carne.",STATEMENT,29
S_25_S22,"I grassi insaturi si trovano in alcuni pesci, il cosiddetto pesce azzurro, e in alcuni oli vegetali... Una carenza di grassi insaturi provoca alterazioni della struttura e nella funzione di enzimi, determinando un certo numero di disturbi...",PERSUASION-SUGGEST,29
S_25_U22,Quale pesce dovrei mangiare?,INFO-REQUEST,29
S_25_S23,"Purtroppo sono poco esperta in questo campo. Sai, gli agenti artificiali vengono addestrati gradualmente, e in domini molto specializzati. Le loro conoscenze, quindi...",TALK-ABOUT-SELF,29
S_25_U23,Quali carni dovrei mangiare?,INFO-REQUEST,29
S_25_S24,"Le proteine necessarie possono essere assunte con due o tre porzioni di carne, latte, uova. Oppure...",OFFER-GIVE-INFO,29
S_25_U24,meglio la carne bianca o la carne rossa?,INFO-REQUEST,29
S_25_S25,"Mi dispiace, non so rispondere a questa domanda",ANSWER,29
S_25_U25,Io faccio molta attività fisica Cosa mi consigli di mangiare?,INFO-REQUEST,29
S_25_S26,Ti consiglio di consultare un esperto oppure puoi cercare informazioni in rete,ANSWER,29
S_25_U26,Grazie Puoi dirmi qualcos’altro sulla dieta?,KIND-ATTITUDE_SMALL-TALK,29
S_25_S27,Hai mai provato a chiederti a cosa sono dovute le tue abitudini alimentari?,QUESTION,29
S_25_U27,No,GENERIC-ANSWER,29
S_25_S28,Molti pensano che mangiare sia soltanto un piacere o un modo per sopravvivere. Invece contribuisce...,PERSUASION-SUGGEST,29
S_25_U28,"Sì, lo so",AGREE,29
S_25_S29,E allora? Dimmi qualcosa di più!,ENCOURAGE-SORRY,29
S_25_U29,"Bevo molto latte, mi piacciono i latticini, il formaggio. Faccio bene a mangiarne molto?",INFO-REQUEST,29
S_25_S30,Credo di sì,ANSWER,29
S_25_U30,Perché?,INFO-REQUEST,29
S_25_S31,Ti consiglio di consultare un esperto oppure puoi cercare informazioni in rete,ANSWER,29
S_25_U31,Grazie.,KIND-ATTITUDE_SMALL-TALK,29
S_25_S32,"Se hai dei problemi, in futuro, torna da me; proveremo a risolverli insieme...",OFFER-GIVE-INFO,29
S_25_U32,Ok. A presto allora.,CLOSING,29
S_25_S33,E' stato davvero piacevole interagire con te. Torna pure quando vuoi.,CLOSING,29
S_25_U33,"No, è stato un piacere. Ciao.",KIND-ATTITUDE_SMALL-TALK,29
S_25_S34,Grazie e arrivederci!,CLOSING,29
T_18_S1,"Ciao, il mio nome e' Valentina. Sono qui per darti dei suggerimenti su come migliorare la tua dieta.",OPENING,30
T_18_U1,ciao io sono carla,OPENING,30
T_18_S2,Quali sono le tue abitudini alimentari?,QUESTION,30
T_18_U2,cerco sempre di mangiare in modo sano,STATEMENT,30
